{
  "version": 2,
  "id": "S01",
  "width": 1920,
  "height": 1080,
  "objects": [
    {
      "id": "S01.O1",
      "x": 550,
      "y": 780,
      "width": 190,
      "height": 126.667,
      "contentId": "S01.C1"
    },
    {
      "id": "S01.O2",
      "x": 800,
      "y": 755,
      "width": 250,
      "height": 166.667,
      "contentId": "S01.C2"
    },
    {
      "id": "S01.O3",
      "x": 1310,
      "y": 255,
      "width": 170,
      "height": 184.836,
      "contentId": "S01.C3"
    },
    {
      "id": "S01.O4",
      "x": 1100,
      "y": 710,
      "width": 310,
      "height": 206.667,
      "contentId": "S01.C4"
    },
    {
      "id": "S01.O5",
      "x": 1550,
      "y": 755,
      "width": 225,
      "height": 150,
      "contentId": "S01.C5"
    },
    {
      "id": "S01.O6",
      "x": 1530,
      "y": 595,
      "width": 185,
      "height": 123.333,
      "contentId": "S01.C6"
    }
  ],
  "contents": [
    {
      "id": "S01.C1",
      "label": "Reporter notebook",
      "clueId": "S01.Clue1",
      "classification": "fiction",
      "sourceRefs": [],
      "editorial": {
        "status": "draft"
      },
      "rights": {
        "status": "unresolved",
        "basis": "Original draft content; clearance not yet recorded"
      }
    },
    {
      "id": "S01.C2",
      "label": "Toronto contact sheet",
      "clueId": "S01.Clue2",
      "classification": "fiction",
      "sourceRefs": [],
      "editorial": {
        "status": "draft"
      },
      "rights": {
        "status": "unresolved",
        "basis": "Original draft content; clearance not yet recorded"
      }
    },
    {
      "id": "S01.C3",
      "label": "May 2013 calendar",
      "clueId": "S01.Clue3",
      "classification": "fiction",
      "sourceRefs": [],
      "editorial": {
        "status": "draft",
        "notes": "Fictional prop establishes scene date context only"
      },
      "rights": {
        "status": "unresolved",
        "basis": "Original draft content; clearance not yet recorded"
      }
    },
    {
      "id": "S01.C4",
      "label": "Assignment folder with office rumour note",
      "clueId": "S01.Clue4",
      "classification": "fiction",
      "sourceRefs": [],
      "editorial": {
        "status": "draft"
      },
      "rights": {
        "status": "unresolved",
        "basis": "Original draft content; clearance not yet recorded"
      }
    },
    {
      "id": "S01.C5",
      "label": "Hogtown Howler clipping",
      "clueId": "S01.Clue5",
      "classification": "fiction",
      "sourceRefs": [],
      "editorial": {
        "status": "draft",
        "notes": "Original fictional newspaper prop; the claim within the clipping remains unproven. Research mapping is maintained outside the shipped game."
      },
      "rights": {
        "status": "unresolved",
        "basis": "Original draft game writing; clearance not yet recorded"
      }
    },
    {
      "id": "S01.C6",
      "label": "Digital recorder",
      "clueId": "S01.Clue6",
      "classification": "fiction",
      "sourceRefs": [],
      "editorial": {
        "status": "draft"
      },
      "rights": {
        "status": "unresolved",
        "basis": "Original draft content; clearance not yet recorded"
      }
    }
  ],
  "sources": [],
  "completion": {
    "type": "find-all",
    "requiredIds": [
      "S01.O1",
      "S01.O2",
      "S01.O3",
      "S01.O4",
      "S01.O5",
      "S01.O6"
    ]
  }
}
