{
  "version": 2,
  "id": "S02",
  "width": 1920,
  "height": 1080,
  "objects": [
    {
      "id": "S02.O1",
      "x": 220,
      "y": 700,
      "width": 210,
      "height": 150,
      "contentId": "S02.C1"
    },
    {
      "id": "S02.O2",
      "x": 470,
      "y": 690,
      "width": 200,
      "height": 160,
      "contentId": "S02.C2"
    },
    {
      "id": "S02.O3",
      "x": 1420,
      "y": 260,
      "width": 170,
      "height": 220,
      "contentId": "S02.C3"
    },
    {
      "id": "S02.O4",
      "x": 900,
      "y": 610,
      "width": 240,
      "height": 200,
      "contentId": "S02.C4"
    },
    {
      "id": "S02.O5",
      "x": 1180,
      "y": 780,
      "width": 130,
      "height": 110,
      "contentId": "S02.C5"
    },
    {
      "id": "S02.O6",
      "x": 1610,
      "y": 660,
      "width": 220,
      "height": 160,
      "contentId": "S02.C6"
    }
  ],
  "contents": [
    {
      "id": "S02.C1",
      "label": "Jammed press-kit tray, page one",
      "clueId": "S02.Clue1",
      "classification": "fiction",
      "sourceRefs": [],
      "editorial": {
        "status": "draft"
      },
      "rights": {
        "status": "unresolved",
        "basis": "Original draft content; clearance not yet recorded"
      }
    },
    {
      "id": "S02.C2",
      "label": "Jammed press-kit page two, May 17 schedule",
      "clueId": "S02.Clue2",
      "classification": "fiction",
      "sourceRefs": [],
      "editorial": {
        "status": "draft",
        "notes": "Fictional prop establishes the same-day public schedule only"
      },
      "rights": {
        "status": "unresolved",
        "basis": "Original draft content; clearance not yet recorded"
      }
    },
    {
      "id": "S02.C3",
      "label": "May 17 public denial summary card",
      "clueId": "S02.Clue3",
      "classification": "fiction",
      "sourceRefs": [],
      "editorial": {
        "status": "draft",
        "notes": "Original fictional summary paraphrasing a dated public response; research mapping is maintained outside the shipped game."
      },
      "rights": {
        "status": "unresolved",
        "basis": "Original draft game writing; clearance not yet recorded"
      }
    },
    {
      "id": "S02.C4",
      "label": "Filing label: mayor's office, public records",
      "clueId": "S02.Clue4",
      "classification": "fiction",
      "sourceRefs": [],
      "editorial": {
        "status": "draft"
      },
      "rights": {
        "status": "unresolved",
        "basis": "Original draft content; clearance not yet recorded"
      }
    },
    {
      "id": "S02.C5",
      "label": "Visitor bell",
      "clueId": "S02.Clue5",
      "classification": "fiction",
      "sourceRefs": [],
      "editorial": {
        "status": "draft"
      },
      "rights": {
        "status": "unresolved",
        "basis": "Original draft content; clearance not yet recorded"
      }
    },
    {
      "id": "S02.C6",
      "label": "May 16 public reporting summary folder",
      "clueId": "S02.Clue6",
      "classification": "fiction",
      "sourceRefs": [],
      "editorial": {
        "status": "draft",
        "notes": "Original fictional summary paraphrasing dated initial public reports; research mapping is maintained outside the shipped game."
      },
      "rights": {
        "status": "unresolved",
        "basis": "Original draft game writing; clearance not yet recorded"
      }
    }
  ],
  "sources": [],
  "completion": {
    "type": "find-all",
    "requiredIds": [
      "S02.O1",
      "S02.O2",
      "S02.O3",
      "S02.O4",
      "S02.O5",
      "S02.O6"
    ]
  }
}
